{
    "$schema": "http://json-schema.org/draft-07/schema#",
    "type": "object",
    "properties": {
      "name": {
        "type": "string"
      },
      "size": {
        "type": "string",
        "enum": ["Tiny", "Small", "Medium", "Large", "Huge", "Gargantuan"]
      },
      "type": {
        "type": "string"
      },
      "alignment": {
        "type": "string"
      },
      "armorClass": {
        "type": "integer",
        "minimum": 1
      },
      "hitPoints": {
        "type": "integer",
        "minimum": 1
      },
      "maxHitPoints": {
        "type": "integer",
        "minimum": 1
      },
      "speed": {
        "type": "integer"
      },
      "alternateSpeeds": {
        "type": "object",
        "additionalProperties": false,
        "properties": {
          "fly": {
            "type": "integer",
            "minimum": 0
          },
          "swim": {
            "type": "integer",
            "minimum": 0
          },
          "burrow": {
            "type": "integer",
            "minimum": 0
          },
          "climb": {
            "type": "integer",
            "minimum": 0
          }
        }
      },
      "abilities": {
        "type": "object",
        "properties": {
          "strength": {
            "type": "integer"
          },
          "dexterity": {
            "type": "integer"
          },
          "constitution": {
            "type": "integer"
          },
          "intelligence": {
            "type": "integer"
          },
          "wisdom": {
            "type": "integer"
          },
          "charisma": {
            "type": "integer"
          }
        },
        "required": [
          "strength",
          "dexterity",
          "constitution",
          "intelligence",
          "wisdom",
          "charisma"
        ]
      },
      "savingThrows": {
        "type": "array",
        "items": {
          "type": "string"
        }
      },
      "skills": {
        "type": "object",
        "additionalProperties": {
          "type": "integer"
        }
      },
      "damageVulnerabilities": {
        "type": "array",
        "items": {
          "type": "string"
        }
      },
      "damageResistances": {
        "type": "array",
        "items": {
          "type": "string"
        }
      },
      "damageImmunities": {
        "type": "array",
        "items": {
          "type": "string"
        }
      },
      "conditionImmunities": {
        "type": "array",
        "items": {
          "type": "string"
        }
      },
      "senses": {
        "type": "object",
        "properties": {
          "darkvision": {
            "type": "integer"
          },
          "passivePerception": {
            "type": "integer"
          }
        }
      },
      "languages": {
        "type": "string"
      },
      "challengeRating": {
        "type": "number",
        "minimum": 0
      },
      "specialAbilities": {
        "type": "array",
        "items": {
          "type": "object",
          "properties": {
            "name": {
              "type": "string"
            },
            "attackBonus": {
              "type": "integer"
            },
            "damageDice": {
              "type": "string"
            },
            "damageBonus": {
              "type": "integer"
            },
            "damageType": {
              "type": "string"
            },
            "kind": {
              "type": "string",
              "enum": ["attack", "save", "trait"]
            },
            "description": {
              "type": "string"
            },
            "save": {
              "type": "object",
              "properties": {
                "ability": {
                  "type": "string",
                  "enum": ["strength", "dexterity", "constitution", "intelligence", "wisdom", "charisma"]
                },
                "dc": {
                  "type": "integer",
                  "minimum": 1
                },
                "halfOnSave": {
                  "type": "boolean"
                },
                "onFail": {
                  "type": "object",
                  "properties": {
                    "damageDice": {
                      "type": "string"
                    },
                    "damageBonus": {
                      "type": "integer"
                    },
                    "damageType": {
                      "type": "string"
                    },
                    "conditions": {
                      "type": "array",
                      "items": {
                        "type": "string",
                        "enum": ["blinded", "charmed", "deafened", "exhaustion", "frightened", "grappled", "incapacitated", "invisible", "paralyzed", "petrified", "poisoned", "prone", "restrained", "stunned", "unconscious"]
                      }
                    },
                    "roundsRemaining": {
                      "type": ["integer", "null"]
                    },
                    "repeatAtEndOfTurn": {
                      "type": "boolean"
                    }
                  },
                  "required": ["damageDice", "damageBonus", "damageType", "conditions"]
                }
              },
              "required": ["ability", "dc", "halfOnSave", "onFail"]
            },
            "rider": {
              "type": "object",
              "properties": {
                "ability": {
                  "type": "string",
                  "enum": ["strength", "dexterity", "constitution", "intelligence", "wisdom", "charisma"]
                },
                "dc": {
                  "type": "integer",
                  "minimum": 1
                },
                "halfOnSave": {
                  "type": "boolean"
                },
                "onFail": {
                  "type": "object",
                  "properties": {
                    "damageDice": {
                      "type": "string"
                    },
                    "damageBonus": {
                      "type": "integer"
                    },
                    "damageType": {
                      "type": "string"
                    },
                    "conditions": {
                      "type": "array",
                      "items": {
                        "type": "string",
                        "enum": ["blinded", "charmed", "deafened", "exhaustion", "frightened", "grappled", "incapacitated", "invisible", "paralyzed", "petrified", "poisoned", "prone", "restrained", "stunned", "unconscious"]
                      }
                    },
                    "roundsRemaining": {
                      "type": ["integer", "null"]
                    },
                    "repeatAtEndOfTurn": {
                      "type": "boolean"
                    }
                  },
                  "required": ["damageDice", "damageBonus", "damageType", "conditions"]
                }
              },
              "required": ["ability", "dc", "halfOnSave", "onFail"]
            },
            "recharge": {
              "type": "object",
              "properties": {
                "min": {
                  "type": "integer",
                  "minimum": 1,
                  "maximum": 6
                },
                "max": {
                  "type": "integer",
                  "minimum": 1,
                  "maximum": 6
                }
              },
              "required": ["min", "max"]
            }
          },
          "required": [
            "name",
            "attackBonus",
            "damageDice",
            "damageBonus",
            "damageType"
          ]
        }
      },
      "actions": {
        "type": "array",
        "items": {
          "type": "object",
          "properties": {
            "name": {
              "type": "string"
            },
            "attackBonus": {
              "type": "integer"
            },
            "damageDice": {
              "type": "string"
            },
            "damageBonus": {
              "type": "integer"
            },
            "damageType": {
              "type": "string"
            },
            "kind": {
              "type": "string",
              "enum": ["attack", "save", "trait"]
            },
            "description": {
              "type": "string"
            },
            "save": {
              "type": "object",
              "properties": {
                "ability": {
                  "type": "string",
                  "enum": ["strength", "dexterity", "constitution", "intelligence", "wisdom", "charisma"]
                },
                "dc": {
                  "type": "integer",
                  "minimum": 1
                },
                "halfOnSave": {
                  "type": "boolean"
                },
                "onFail": {
                  "type": "object",
                  "properties": {
                    "damageDice": {
                      "type": "string"
                    },
                    "damageBonus": {
                      "type": "integer"
                    },
                    "damageType": {
                      "type": "string"
                    },
                    "conditions": {
                      "type": "array",
                      "items": {
                        "type": "string",
                        "enum": ["blinded", "charmed", "deafened", "exhaustion", "frightened", "grappled", "incapacitated", "invisible", "paralyzed", "petrified", "poisoned", "prone", "restrained", "stunned", "unconscious"]
                      }
                    },
                    "roundsRemaining": {
                      "type": ["integer", "null"]
                    },
                    "repeatAtEndOfTurn": {
                      "type": "boolean"
                    }
                  },
                  "required": ["damageDice", "damageBonus", "damageType", "conditions"]
                }
              },
              "required": ["ability", "dc", "halfOnSave", "onFail"]
            },
            "rider": {
              "type": "object",
              "properties": {
                "ability": {
                  "type": "string",
                  "enum": ["strength", "dexterity", "constitution", "intelligence", "wisdom", "charisma"]
                },
                "dc": {
                  "type": "integer",
                  "minimum": 1
                },
                "halfOnSave": {
                  "type": "boolean"
                },
                "onFail": {
                  "type": "object",
                  "properties": {
                    "damageDice": {
                      "type": "string"
                    },
                    "damageBonus": {
                      "type": "integer"
                    },
                    "damageType": {
                      "type": "string"
                    },
                    "conditions": {
                      "type": "array",
                      "items": {
                        "type": "string",
                        "enum": ["blinded", "charmed", "deafened", "exhaustion", "frightened", "grappled", "incapacitated", "invisible", "paralyzed", "petrified", "poisoned", "prone", "restrained", "stunned", "unconscious"]
                      }
                    },
                    "roundsRemaining": {
                      "type": ["integer", "null"]
                    },
                    "repeatAtEndOfTurn": {
                      "type": "boolean"
                    }
                  },
                  "required": ["damageDice", "damageBonus", "damageType", "conditions"]
                }
              },
              "required": ["ability", "dc", "halfOnSave", "onFail"]
            },
            "recharge": {
              "type": "object",
              "properties": {
                "min": {
                  "type": "integer",
                  "minimum": 1,
                  "maximum": 6
                },
                "max": {
                  "type": "integer",
                  "minimum": 1,
                  "maximum": 6
                }
              },
              "required": ["min", "max"]
            }
          },
          "required": [
            "name",
            "attackBonus",
            "damageDice",
            "damageBonus",
            "damageType"
          ]
        }
      },
      "legendaryActions": {
        "type": "array",
        "items": {
          "type": "object",
          "properties": {
            "name": {
              "type": "string"
            },
            "description": {
              "type": "string"
            }
          },
          "required": [
            "name",
            "description"
          ]
        }
      },
      "condition": {
        "type": "string",
        "enum": ["Alive", "Dead"]
      },
      "spellcasting": {
        "type": "object",
        "properties": {
          "ability": {
            "type": "string",
            "enum": ["Intelligence", "Wisdom", "Charisma"]
          },
          "spellSaveDC": {
            "type": "integer"
          },
          "spellAttackBonus": {
            "type": "integer"
          },
          "spells": {
            "type": "object",
            "properties": {
              "cantrips": {
                "type": "array",
                "items": {
                  "type": "string"
                }
              },
              "level1": {
                "type": "array",
                "items": {
                  "type": "string"
                }
              },
              "level2": {
                "type": "array",
                "items": {
                  "type": "string"
                }
              },
              "level3": {
                "type": "array",
                "items": {
                  "type": "string"
                }
              },
              "level4": {
                "type": "array",
                "items": {
                  "type": "string"
                }
              },
              "level5": {
                "type": "array",
                "items": {
                  "type": "string"
                }
              },
              "level6": {
                "type": "array",
                "items": {
                  "type": "string"
                }
              },
              "level7": {
                "type": "array",
                "items": {
                  "type": "string"
                }
              },
              "level8": {
                "type": "array",
                "items": {
                  "type": "string"
                }
              },
              "level9": {
                "type": "array",
                "items": {
                  "type": "string"
                }
              }
            }
          }
        },
        "required": ["ability", "spellSaveDC", "spellAttackBonus", "spells"]
      }
    },
    "required": [
      "name",
      "size",
      "type",
      "alignment",
      "armorClass",
      "hitPoints",
      "maxHitPoints",
      "speed",
      "abilities",
      "savingThrows",
      "skills",
      "damageVulnerabilities",
      "damageResistances",
      "damageImmunities",
      "conditionImmunities",
      "senses",
      "languages",
      "challengeRating",
      "specialAbilities",
      "actions",
      "legendaryActions",
      "condition"
    ]
  }