{
  "name": "Guard",
  "size": "Medium",
  "type": "Humanoid",
  "alignment": "Any alignment",
  "armorClass": 16,
  "hitPoints": 11,
  "maxHitPoints": 11,
  "speed": 30,
  "abilities": {
    "strength": 13,
    "dexterity": 12,
    "constitution": 12,
    "intelligence": 10,
    "wisdom": 11,
    "charisma": 10
  },
  "savingThrows": [],
  "skills": {
    "Perception": 2
  },
  "damageVulnerabilities": [],
  "damageResistances": [],
  "damageImmunities": [],
  "conditionImmunities": [],
  "senses": {
    "darkvision": 0,
    "passivePerception": 12
  },
  "languages": "Common, any one language",
  "challengeRating": 0.125,
  "specialAbilities": [],
  "actions": [
    {
      "name": "Spear",
      "attackBonus": 3,
      "damageDice": "1d6",
      "damageBonus": 1,
      "damageType": "piercing"
    }
  ],
  "legendaryActions": [],
  "condition": "Alive"
}