{
  "name": "Shadow of Sir Garran",
  "size": "Medium",
  "type": "Undead",
  "alignment": "Chaotic Evil",
  "armorClass": 13,
  "hitPoints": 27,
  "maxHitPoints": 27,
  "speed": 40,
  "abilities": {
    "strength": 6,
    "dexterity": 16,
    "constitution": 13,
    "intelligence": 10,
    "wisdom": 12,
    "charisma": 14
  },
  "savingThrows": [
    "Dexterity",
    "Charisma"
  ],
  "skills": {
    "stealth": 5,
    "perception": 3
  },
  "damageVulnerabilities": [
    "radiant"
  ],
  "damageResistances": [
    "acid",
    "cold",
    "fire",
    "lightning",
    "thunder",
    "bludgeoning",
    "piercing",
    "slashing from nonmagical attacks"
  ],
  "damageImmunities": [
    "necrotic",
    "poison"
  ],
  "conditionImmunities": [
    "charmed",
    "exhaustion",
    "frightened",
    "grappled",
    "paralyzed",
    "petrified",
    "poisoned",
    "prone",
    "restrained"
  ],
  "senses": {
    "darkvision": 60,
    "passivePerception": 13
  },
  "languages": "Understands all languages it knew in life but can't speak",
  "challengeRating": 1,
  "specialAbilities": [
    {
      "name": "Amorphous",
      "attackBonus": 0,
      "damageDice": "0",
      "damageBonus": 0,
      "damageType": "none"
    },
    {
      "name": "Shadow Stealth",
      "attackBonus": 0,
      "damageDice": "0",
      "damageBonus": 0,
      "damageType": "none"
    },
    {
      "name": "Sunlight Weakness",
      "attackBonus": 0,
      "damageDice": "0",
      "damageBonus": 0,
      "damageType": "none"
    }
  ],
  "actions": [
    {
      "name": "Strength Drain",
      "attackBonus": 5,
      "damageDice": "2d6",
      "damageBonus": 2,
      "damageType": "necrotic"
    }
  ],
  "legendaryActions": [],
  "condition": "Alive"
}