{
  "name": "Phantom Servant",
  "size": "Medium",
  "type": "Undead",
  "alignment": "Neutral Evil",
  "armorClass": 13,
  "hitPoints": 16,
  "maxHitPoints": 16,
  "speed": 30,
  "abilities": {
    "strength": 8,
    "dexterity": 16,
    "constitution": 10,
    "intelligence": 11,
    "wisdom": 12,
    "charisma": 13
  },
  "savingThrows": [],
  "skills": {
    "Stealth": 5,
    "Perception": 3
  },
  "damageVulnerabilities": [
    "force"
  ],
  "damageResistances": [
    "acid",
    "cold",
    "fire",
    "lightning",
    "thunder"
  ],
  "damageImmunities": [
    "necrotic",
    "poison"
  ],
  "conditionImmunities": [
    "charmed",
    "exhaustion",
    "grappled",
    "paralyzed",
    "petrified",
    "poisoned",
    "prone",
    "restrained"
  ],
  "senses": {
    "darkvision": 60,
    "passivePerception": 13
  },
  "languages": "Understands the languages of its creator but can't speak",
  "challengeRating": 1,
  "specialAbilities": [
    {
      "name": "Incorporeal Movement",
      "attackBonus": 0,
      "damageDice": "",
      "damageBonus": 0,
      "damageType": ""
    },
    {
      "name": "Ethereal Sight",
      "attackBonus": 0,
      "damageDice": "",
      "damageBonus": 0,
      "damageType": ""
    }
  ],
  "actions": [
    {
      "name": "Chill Touch",
      "attackBonus": 5,
      "damageDice": "1d8",
      "damageBonus": 0,
      "damageType": "necrotic"
    }
  ],
  "legendaryActions": [],
  "condition": "Alive"
}