{
  "name": "Stone Guardian",
  "size": "Medium",
  "type": "Construct",
  "alignment": "Unaligned",
  "armorClass": 16,
  "hitPoints": 32,
  "maxHitPoints": 32,
  "speed": 20,
  "abilities": {
    "strength": 15,
    "dexterity": 8,
    "constitution": 16,
    "intelligence": 3,
    "wisdom": 10,
    "charisma": 5
  },
  "savingThrows": [],
  "skills": {},
  "damageVulnerabilities": [
    "thunder"
  ],
  "damageResistances": [
    "bludgeoning",
    "piercing",
    "slashing"
  ],
  "damageImmunities": [
    "poison",
    "psychic"
  ],
  "conditionImmunities": [
    "charmed",
    "exhaustion",
    "frightened",
    "paralyzed",
    "poisoned"
  ],
  "senses": {
    "darkvision": 60,
    "passivePerception": 10
  },
  "languages": "understands the languages of its creator but can't speak",
  "challengeRating": 1,
  "specialAbilities": [
    {
      "name": "False Appearance",
      "attackBonus": 0,
      "damageDice": "",
      "damageBonus": 0,
      "damageType": ""
    }
  ],
  "actions": [
    {
      "name": "Slam",
      "attackBonus": 4,
      "damageDice": "1d10",
      "damageBonus": 2,
      "damageType": "bludgeoning"
    }
  ],
  "legendaryActions": [],
  "condition": "Alive"
}