{
  "name": "Bog Mummy",
  "size": "Medium",
  "type": "Undead",
  "alignment": "Neutral Evil",
  "armorClass": 11,
  "hitPoints": 22,
  "maxHitPoints": 22,
  "speed": 20,
  "abilities": {
    "strength": 14,
    "dexterity": 8,
    "constitution": 16,
    "intelligence": 6,
    "wisdom": 10,
    "charisma": 12
  },
  "savingThrows": [
    "Wisdom",
    "Charisma"
  ],
  "skills": {
    "Perception": 2,
    "Stealth": 0
  },
  "damageVulnerabilities": [
    "fire"
  ],
  "damageResistances": [
    "acid",
    "cold",
    "necrotic"
  ],
  "damageImmunities": [
    "poison"
  ],
  "conditionImmunities": [
    "poisoned",
    "charmed",
    "frightened"
  ],
  "senses": {
    "darkvision": 60,
    "passivePerception": 12
  },
  "languages": "understands the languages it knew in life but can't speak",
  "challengeRating": 1,
  "specialAbilities": [
    {
      "name": "Bog Body",
      "attackBonus": 0,
      "damageDice": "0",
      "damageBonus": 0,
      "damageType": "none"
    },
    {
      "name": "Stench of the Mire",
      "attackBonus": 0,
      "damageDice": "0",
      "damageBonus": 0,
      "damageType": "poison"
    }
  ],
  "actions": [
    {
      "name": "Rotting Slam",
      "attackBonus": 4,
      "damageDice": "2d6",
      "damageBonus": 2,
      "damageType": "bludgeoning"
    },
    {
      "name": "Dreadful Glare",
      "attackBonus": 0,
      "damageDice": "0",
      "damageBonus": 0,
      "damageType": "psychic"
    }
  ],
  "legendaryActions": [],
  "condition": "Alive"
}