{
  "name": "Skeleton",
  "size": "Medium",
  "type": "Undead",
  "alignment": "Lawful Evil",
  "armorClass": 13,
  "hitPoints": 13,
  "maxHitPoints": 13,
  "speed": 30,
  "abilities": {
    "strength": 10,
    "dexterity": 14,
    "constitution": 15,
    "intelligence": 6,
    "wisdom": 8,
    "charisma": 5
  },
  "savingThrows": [],
  "skills": {
    "Perception": 2
  },
  "damageVulnerabilities": [
    "bludgeoning"
  ],
  "damageResistances": [],
  "damageImmunities": [
    "poison"
  ],
  "conditionImmunities": [
    "poisoned",
    "exhaustion"
  ],
  "senses": {
    "darkvision": 60,
    "passivePerception": 9
  },
  "languages": "Understands all languages it knew in life but can't speak",
  "challengeRating": 0.25,
  "specialAbilities": [
    {
      "name": "Undead Fortitude",
      "attackBonus": 0,
      "damageDice": "0",
      "damageBonus": 0,
      "damageType": "none"
    }
  ],
  "actions": [
    {
      "name": "Shortsword",
      "attackBonus": 4,
      "damageDice": "1d6",
      "damageBonus": 2,
      "damageType": "piercing"
    },
    {
      "name": "Shortbow",
      "attackBonus": 4,
      "damageDice": "1d6",
      "damageBonus": 2,
      "damageType": "piercing"
    }
  ],
  "legendaryActions": [],
  "condition": "Alive"
}