{
  "name": "Shadow",
  "size": "Medium",
  "type": "Undead",
  "alignment": "Chaotic Evil",
  "armorClass": 12,
  "hitPoints": 16,
  "maxHitPoints": 16,
  "speed": 40,
  "abilities": {
    "strength": 6,
    "dexterity": 14,
    "constitution": 13,
    "intelligence": 6,
    "wisdom": 10,
    "charisma": 8
  },
  "savingThrows": [],
  "skills": {
    "stealth": 4
  },
  "damageVulnerabilities": [
    "radiant"
  ],
  "damageResistances": [
    "acid",
    "cold",
    "fire",
    "lightning",
    "thunder",
    "bludgeoning",
    "piercing",
    "slashing"
  ],
  "damageImmunities": [
    "necrotic",
    "poison"
  ],
  "conditionImmunities": [
    "exhaustion",
    "frightened",
    "grappled",
    "paralyzed",
    "petrified",
    "poisoned",
    "prone",
    "restrained"
  ],
  "senses": {
    "darkvision": 60,
    "passivePerception": 10
  },
  "languages": "Understands Common but can't speak",
  "challengeRating": 0.5,
  "specialAbilities": [
    {
      "name": "Amorphous",
      "attackBonus": 0,
      "damageDice": "0d0",
      "damageBonus": 0,
      "damageType": "none"
    },
    {
      "name": "Shadow Stealth",
      "attackBonus": 0,
      "damageDice": "0d0",
      "damageBonus": 0,
      "damageType": "none"
    },
    {
      "name": "Sunlight Weakness",
      "attackBonus": 0,
      "damageDice": "0d0",
      "damageBonus": 0,
      "damageType": "none"
    }
  ],
  "actions": [
    {
      "name": "Strength Drain",
      "attackBonus": 4,
      "damageDice": "2d6",
      "damageBonus": 2,
      "damageType": "necrotic"
    }
  ],
  "legendaryActions": [],
  "condition": "Alive"
}
