{
  "name": "Shadow Cage",
  "size": "Medium",
  "type": "Undead",
  "alignment": "Neutral Evil",
  "armorClass": 13,
  "hitPoints": 27,
  "maxHitPoints": 27,
  "speed": 30,
  "abilities": {
    "strength": 8,
    "dexterity": 16,
    "constitution": 12,
    "intelligence": 10,
    "wisdom": 14,
    "charisma": 12
  },
  "savingThrows": [
    "Dexterity",
    "Wisdom"
  ],
  "skills": {
    "Stealth": 5,
    "Perception": 4
  },
  "damageVulnerabilities": [
    "radiant"
  ],
  "damageResistances": [
    "acid",
    "cold",
    "fire",
    "lightning",
    "thunder",
    "bludgeoning",
    "piercing",
    "slashing from nonmagical attacks"
  ],
  "damageImmunities": [
    "necrotic",
    "poison"
  ],
  "conditionImmunities": [
    "charmed",
    "exhaustion",
    "frightened",
    "grappled",
    "paralyzed",
    "petrified",
    "poisoned",
    "prone",
    "restrained"
  ],
  "senses": {
    "darkvision": 60,
    "passivePerception": 14
  },
  "languages": "Understands Common and one other language it knew in life but can't speak",
  "challengeRating": 1,
  "specialAbilities": [
    {
      "name": "Shadow Stealth",
      "attackBonus": 0,
      "damageDice": "0",
      "damageBonus": 0,
      "damageType": "none"
    },
    {
      "name": "Incorporeal Movement",
      "attackBonus": 0,
      "damageDice": "0",
      "damageBonus": 0,
      "damageType": "none"
    },
    {
      "name": "Cage of Shadows (Recharge 5-6)",
      "attackBonus": 0,
      "damageDice": "0",
      "damageBonus": 0,
      "damageType": "none"
    }
  ],
  "actions": [
    {
      "name": "Shadowy Grasp",
      "attackBonus": 5,
      "damageDice": "2d6",
      "damageBonus": 3,
      "damageType": "necrotic"
    }
  ],
  "legendaryActions": [],
  "condition": "Alive"
}