{
  "name": "Nest Lurker",
  "size": "Small",
  "type": "Monstrosity",
  "alignment": "Unaligned",
  "armorClass": 14,
  "hitPoints": 18,
  "maxHitPoints": 18,
  "speed": 30,
  "abilities": {
    "strength": 13,
    "dexterity": 16,
    "constitution": 12,
    "intelligence": 4,
    "wisdom": 11,
    "charisma": 5
  },
  "savingThrows": [],
  "skills": {
    "stealth": 5,
    "perception": 3
  },
  "damageVulnerabilities": [],
  "damageResistances": [],
  "damageImmunities": [],
  "conditionImmunities": [],
  "senses": {
    "darkvision": 60,
    "passivePerception": 13
  },
  "languages": "",
  "challengeRating": 0.5,
  "specialAbilities": [
    {
      "name": "Keen Smell",
      "attackBonus": 0,
      "damageDice": "0",
      "damageBonus": 0,
      "damageType": "None"
    }
  ],
  "actions": [
    {
      "name": "Bite",
      "attackBonus": 4,
      "damageDice": "1d6",
      "damageBonus": 2,
      "damageType": "piercing"
    }
  ],
  "legendaryActions": [],
  "condition": "Alive"
}
