{
  "name": "Bloodshadow",
  "size": "Medium",
  "type": "Undead",
  "alignment": "Chaotic Evil",
  "armorClass": 14,
  "hitPoints": 45,
  "maxHitPoints": 45,
  "speed": 40,
  "abilities": {
    "strength": 12,
    "dexterity": 17,
    "constitution": 15,
    "intelligence": 5,
    "wisdom": 10,
    "charisma": 6
  },
  "savingThrows": [],
  "skills": {
    "stealth": 6
  },
  "damageVulnerabilities": [
    "radiant"
  ],
  "damageResistances": [
    "acid",
    "cold",
    "fire",
    "lightning",
    "thunder",
    "bludgeoning",
    "piercing",
    "slashing"
  ],
  "damageImmunities": [
    "necrotic",
    "poison"
  ],
  "conditionImmunities": [
    "exhaustion",
    "frightened",
    "grappled",
    "paralyzed",
    "petrified",
    "poisoned",
    "prone",
    "restrained"
  ],
  "senses": {
    "darkvision": 60,
    "passivePerception": 10
  },
  "languages": "Understands languages known in life but cannot speak",
  "challengeRating": 2,
  "specialAbilities": [
    {
      "name": "Shadow Stealth",
      "attackBonus": 0,
      "damageDice": "0",
      "damageBonus": 0,
      "damageType": "None"
    }
  ],
  "actions": [
    {
      "name": "Life Drain",
      "attackBonus": 5,
      "damageDice": "3d6",
      "damageBonus": 0,
      "damageType": "necrotic"
    }
  ],
  "legendaryActions": [],
  "condition": "Alive"
}
