{
  "name": "Wisp of Memory",
  "size": "Tiny",
  "type": "Undead",
  "alignment": "Neutral",
  "armorClass": 13,
  "hitPoints": 10,
  "maxHitPoints": 10,
  "speed": 0,
  "abilities": {
    "strength": 1,
    "dexterity": 16,
    "constitution": 10,
    "intelligence": 12,
    "wisdom": 14,
    "charisma": 14
  },
  "savingThrows": [],
  "skills": {
    "Perception": 4,
    "Stealth": 5
  },
  "damageVulnerabilities": [
    "radiant"
  ],
  "damageResistances": [
    "necrotic",
    "cold",
    "lightning",
    "bludgeoning",
    "piercing",
    "slashing from nonmagical attacks"
  ],
  "damageImmunities": [],
  "conditionImmunities": [
    "charmed",
    "exhaustion",
    "grappled",
    "paralyzed",
    "petrified",
    "poisoned",
    "prone",
    "restrained"
  ],
  "senses": {
    "darkvision": 60,
    "passivePerception": 14
  },
  "languages": "understands all languages it knew in life but can't speak",
  "challengeRating": 1,
  "specialAbilities": [
    {
      "name": "Incorporeal Movement",
      "attackBonus": 0,
      "damageDice": "",
      "damageBonus": 0,
      "damageType": "none"
    },
    {
      "name": "Ephemeral",
      "attackBonus": 0,
      "damageDice": "",
      "damageBonus": 0,
      "damageType": "none"
    },
    {
      "name": "Fade Away",
      "attackBonus": 0,
      "damageDice": "",
      "damageBonus": 0,
      "damageType": "none"
    }
  ],
  "actions": [
    {
      "name": "Memory Drain",
      "attackBonus": 4,
      "damageDice": "2d6",
      "damageBonus": 2,
      "damageType": "psychic"
    }
  ],
  "legendaryActions": [],
  "condition": "Alive"
}