{
  "name": "Wolf",
  "size": "Medium",
  "type": "Beast",
  "alignment": "Unaligned",
  "armorClass": 13,
  "hitPoints": 11,
  "maxHitPoints": 11,
  "speed": 40,
  "abilities": {
    "strength": 12,
    "dexterity": 15,
    "constitution": 12,
    "intelligence": 3,
    "wisdom": 12,
    "charisma": 6
  },
  "savingThrows": [],
  "skills": {
    "perception": 3,
    "stealth": 4
  },
  "damageVulnerabilities": [],
  "damageResistances": [],
  "damageImmunities": [],
  "conditionImmunities": [],
  "senses": {
    "darkvision": 0,
    "passivePerception": 13
  },
  "languages": "\u2014",
  "challengeRating": 0.25,
  "specialAbilities": [
    {
      "name": "Keen Hearing and Smell",
      "attackBonus": 0,
      "damageDice": "0",
      "damageBonus": 0,
      "damageType": "None"
    },
    {
      "name": "Pack Tactics",
      "attackBonus": 0,
      "damageDice": "0",
      "damageBonus": 0,
      "damageType": "None"
    }
  ],
  "actions": [
    {
      "name": "Bite",
      "attackBonus": 4,
      "damageDice": "2d4",
      "damageBonus": 2,
      "damageType": "piercing"
    }
  ],
  "legendaryActions": [],
  "condition": "Alive"
}