{
  "name": "Spectral Wayfarer",
  "size": "Medium",
  "type": "Undead",
  "alignment": "Neutral",
  "armorClass": 12,
  "hitPoints": 13,
  "maxHitPoints": 13,
  "speed": 0,
  "abilities": {
    "strength": 6,
    "dexterity": 15,
    "constitution": 10,
    "intelligence": 12,
    "wisdom": 13,
    "charisma": 15
  },
  "savingThrows": [],
  "skills": {
    "Perception": 3,
    "Stealth": 4
  },
  "damageVulnerabilities": [
    "force"
  ],
  "damageResistances": [
    "acid",
    "fire",
    "lightning",
    "thunder",
    "bludgeoning",
    "piercing",
    "slashing"
  ],
  "damageImmunities": [
    "cold",
    "necrotic",
    "poison"
  ],
  "conditionImmunities": [
    "charmed",
    "exhaustion",
    "grappled",
    "paralyzed",
    "petrified",
    "poisoned",
    "prone",
    "restrained"
  ],
  "senses": {
    "darkvision": 60,
    "passivePerception": 13
  },
  "languages": "understands all languages it knew in life but can't speak",
  "challengeRating": 0.5,
  "specialAbilities": [
    {
      "name": "Incorporeal Movement",
      "attackBonus": 0,
      "damageDice": "0",
      "damageBonus": 0,
      "damageType": "none"
    },
    {
      "name": "Ethereal Sight",
      "attackBonus": 0,
      "damageDice": "0",
      "damageBonus": 0,
      "damageType": "none"
    }
  ],
  "actions": [
    {
      "name": "Withering Touch",
      "attackBonus": 4,
      "damageDice": "1d8",
      "damageBonus": 2,
      "damageType": "necrotic"
    }
  ],
  "legendaryActions": [],
  "condition": "Alive"
}